<?xml version="1.0" encoding="utf-8"?>
<xs:schema attributeFormDefault="unqualified" elementFormDefault="qualified" xmlns:xs="http://www.w3.org/2001/XMLSchema">
  <xs:element name="elements">
    <xs:complexType>
      <xs:sequence>
        <xs:element maxOccurs="unbounded" name="element">
          <xs:complexType>
            <xs:attribute name="Code" type="xs:string" use="required" />
            <xs:attribute name="Name" type="xs:string" use="required" />
            <xs:attribute name="Mass" type="xs:double" use="required" />
            <xs:attribute name="Valency" type="xs:unsignedByte" use="required" />
          </xs:complexType>
        </xs:element>
      </xs:sequence>
    </xs:complexType>
  </xs:element>
</xs:schema>